{
  "schema_version": 1,
  "frontend": "unreal",
  "run_id": "unreal_smoke_aerosonde",
  "aircraft": {"path": "../aircraft/aerosonde.json"},
  "clock": {"fixed_dt_s": 0.008333333333333333, "motion_solver": "chaos"},
  "world": {
    "origin_latitude_deg": 40.2338,
    "origin_longitude_deg": -111.6585,
    "origin_altitude_msl_m": 1387.0,
    "starting_heading_deg": 0.0,
    "geoid_undulation_m": -17.0
  },
  "atmosphere": {"kind": "isa", "wind_ned_mps": [0.0, 0.0, 0.0]},
  "initial_state": {
    "position_ned_m": [0.0, 0.0, -100.0],
    "q_body_to_ned": [1.0, 0.0, 0.0, 0.0],
    "velocity_body_mps": [25.0, 0.0, 0.0],
    "omega_body_radps": [0.0, 0.0, 0.0]
  },
  "controls": {
    "input_boundary": "aircraft_command",
    "mode": "absolute",
    "final": "hold",
    "schedule": [
      {
        "apply_tick": 0,
        "values": {
          "aileron": 0.0,
          "elevator": -0.08,
          "rudder": 0.0,
          "throttle": 0.55
        }
      },
      {"apply_tick": 240, "values": {"elevator": -0.07}},
      {"apply_tick": 360, "values": {"elevator": -0.09}},
      {"apply_tick": 480, "values": {"elevator": -0.08}}
    ]
  },
  "stop": {"duration_s": 6.0},
  "output_root": "../../runs"
}
