{
  "schema_version": 1,
  "frontend": "unreal",
  "run_id": "unreal_ardupilot_aerosonde",
  "aircraft": {"path": "../aircraft/aerosonde.json"},
  "clock": {"fixed_dt_s": 0.008333333333333333, "motion_solver": "chaos"},
  "world": {
    "origin_latitude_deg": 40.2338,
    "origin_longitude_deg": -111.6585,
    "origin_altitude_msl_m": 1387.0,
    "starting_heading_deg": 0.0,
    "geoid_undulation_m": -17.0,
    "cesium": {"tileset_asset_id": 1}
  },
  "atmosphere": {"kind": "isa", "wind_ned_mps": [0.0, 0.0, 0.0]},
  "initial_state": {
    "position_ned_m": [0.0, 0.0, 0.0],
    "q_body_to_ned": [1.0, 0.0, 0.0, 0.0],
    "velocity_body_mps": [25.0, 0.0, 0.0],
    "omega_body_radps": [0.0, 0.0, 0.0]
  },
  "controls": {
    "input_boundary": "aircraft_command",
    "mode": "absolute",
    "final": "hold",
    "schedule": [{"apply_tick": 0, "values": {"aileron": 0.0, "elevator": -0.08, "rudder": 0.0, "throttle": 0.55}}]
  },
  "controller": {
    "kind": "ardupilot_json",
    "firmware_commit": "e0652af4c0c9657c04672ed3e21b71de75c74763",
    "mode": "FBWA",
    "udp_port": 9002,
    "startup_timeout_s": 120.0,
    "packet_timeout_s": 10.0,
    "warmup_s": 10.0
  },
  "stop": {"duration_s": 30.0},
  "output_root": "../../runs"
}
